index,plate,review_reason_code,customer_meaning,reviewer_comments,status,review_reason_code,meaning
19887,LRA2788,2,LUCKY NUMBERS,88 = HATE NUMBER,N,1,LUCKY NUMBERS
7708,WTF Z33,3,MY CAR IS Z33 AND THIS IS MY DREAM CAR. MY MOTHER BOUGHT ME THIS DREAM CAR. WTF HIS HER CHINA NAME WONG TIN FANG,WTF-WHAT THE FUCK,N,1,MY CAR IS Z33 AND THIS IS MY DREAM CAR. MY MOTHER BOUGHT ME THIS DREAM CAR. WTF HIS HER CHINA NAME WONG TIN FANG
6525,SOMOIST,1,I AM A PROFESSIONAL CAKE DECORATOR,SO MOIST,N,1,I AM A PROFESSIONAL CAKE DECORATOR  AND THE CAKE IS DELICIOUS AND MOIST
19039,FUKI5I5,,I AM AGAINST TERRORISM,FUCK ISIS,N,3,I AM AGAINST TERRORISM. FUCK ISIS
8378,GOOOOON,2,PLATES ARE GOING ON A 71 DATSUN WAGON. IN THE CAR SCENE THE DATSUN WAGONS ARE REFFERED TO AS GOONS,GOON ANOTHER WORD FOR THUG OR GANGSTER,N,1,PLATES ARE GOING ON A 71 DATSUN WAGON. IN THE CAR SCENE THE DATSUN WAGONS ARE REFFERED TO AS GOONS
17795,PSYCHPS,1,AM A PSYCHOLOGIST IN PALM SPRINGS,LOOS LIKE A SEXUAL REFERENCE OR PSYCH PS,N,1,AM A PSYCHOLOGIST IN PALM SPRINGS
9272,LES 14,7,LESTER 2014,14-HITLER,N,1,LESTER 2014
13128,O1TIME,2,YOU ONLY HAVE TO LOOK AT IT ONE TIME!,LOOK A LIKE,N,1,YOU ONLY HAVE TO LOOK AT IT ONE TIME!
5897,PORKYYY,2,nickname,insulting,N,1,nickname
4859,BONG 14,2,DEPECHE MODE,WEED AND HITLER. DEPECHE MODE SINGLE,N,1,DEPECHE MODE WHICH IS MUSIC BAND NAME
19520,H8 RICE,2,I HAVE A GLUTEN ALLERGY AND I FIND IT FUNNY.,HATE,N,1,I HAVE A GLUTEN ALLERGY AND I DONT LIKE RICE
15014,NOHA SAD,,NO HATE,CAN NOT TRANSLATE,N,0,
5266,VACA 13,2,OUR FAMILYS LAST NAME AND THE DAY I WAS BORN.,13 GANG REFERENCE (nothing on ANI),N,1,OUR FAMILYS LAST NAME AND THE DAY I WAS BORN.
738,DAMMITT,3,MY KIDS INTIALS,DAMN IT,N,2,DAMN IT
10113,BSTD G8,7,VEHICLE MODEL AND ENGINE TYPE,BASTARD… BEASTED…,Y,2,BASTARD… BEASTED…
4745,7NT X XX,1,MICRO NOT AVAILABLE,XXX SEXUAL TERM,N,0,
23185,PACKER G,2,GREEN BAY PACKER FAN AND THE G STANDS FOR GARCOUSHA OUR LAST NAME,"G, GANG REFERENCE",Y,1,GREEN BAY PACKER FAN AND THE G STANDS FOR GARCOUSHA OUR LAST NAME
2066,BTF OFF,3,BEST TO HAVE FRIDAYS OFF,BACK THE FUCK OFF,N,2,BACK THE FUCK OFF
7267,GOOCH,1,LAST NAME,PRIVATE AREA,N,3,LAST NAME AND PRIVATE AREA
7919,GANGFWD,7,GANG FORWARD IS THE MOTO FOR THE SURNAME STERLING,GANG? WHAT THEY SAY IS TRUE,N,2,GANG? WHAT THEY SAY IS TRUE
8295,S$M 18,2,LUCKY LOVE NUMBER,18-HITLER,N,1,LUCKY LOVE NUMBER
8461,MMA DUBZ,3,mama washington aka mama dubz,"customer is Katrina Coles, not Washington. Dubs can have a drug connotation",N,2,"customer is Katrina Coles, not Washington. Dubs can have a drug connotation"
3191,13BLKRT,2,2013 BLACK CHALLENGER RT,13-GANG,Y,1,2013 BLACK CHALLENGER RT
19016,BJS HEMI,,IT MEANS THE HEMI 5.7 IS MINE.,BJS BLOW JOB CUSTOMER INITIALS NOT BJ,Y,2,BJS BLOW JOB CUSTOMER INITIALS NOT BJ
19733,XTRRMN8,2,EXTERMINATE - FROM DOCTOR WHO,"EXTERMINATE, COULD BE TAKEN AS HOSTILE",N,3,"EXTERMINATE - FROM DOCTOR WHO EXTERMINATE, COULD BE TAKEN AS HOSTILE"
17475,ITSHUGE,1,THE PLATE IS FOR A NISSAN ARMADA AND ITS  VERY LARGE.,"REFERENCE TO A PENIS, SEXUAL REFERENCE",N,3,"THE PLATE IS FOR A NISSAN ARMADA AND ITS  VERY LARGE. REFERENCE TO A PENIS, SEXUAL REFERENCE"
22354,SNO BOMR,2,SNOW BOMBER,BOMBER,N,1,SNOW BOMBER
3088,O11235B,6,GOLDEN RATIO,LOOKS LIKE AN OLD TIN NUMBER,N,3,Fibonacci sequence which is a mathematic term
9430,1DRLUST,1,WANDERLUST- LIKE TO TRAVEL,WONDER LUST,Y,2,WONDER LUST
14706,8O H O8,2,80=MY UNCLE 08 MY GRANDSON H IS FOR NAME,88=HATE SYMBOL,Y,1,80=MY UNCLE 08 MY GRANDSON H IS FOR NAME
3015,14 CBYC,2,CABRILLO BEACH YACHT CLUB COMMODORE 2014,14-HITLER. CABRILLO BEACH YACHT CLUB,Y,1,CABRILLO BEACH YACHT CLUB COMMODORE 2014
12809,BRAD13,2,THIS IS MY NICK NAME AS MY FIRST NAME IS  BRIDGETTE AND MY LAST NAME IS RADABAUGH. I PICKED 13 BECAUSE IT IS MY BIRTHDAY AND MY FAVORITE NUMBER,"13, GANG REFERENCE",N,1,THIS IS MY NICK NAME AS MY FIRST NAME IS  BRIDGETTE AND MY LAST NAME IS RADABAUGH. I PICKED 13 BECAUSE IT IS MY BIRTHDAY AND MY FAVORITE NUMBER
22844,ZMBONEE,1,A ZAMBONIE IS A MACHINE USED TO GET ICE READY TO PLAY HOCKEY,BONE COULD BE CONSIDERED SEXUAL,Y,1,A ZAMBONIE IS A MACHINE USED TO GET ICE READY TO PLAY HOCKEY
7343,IH8TRFC,2,no quickweb,I hate traffic,Y,3,"I hate traffic,no quickweb"
14664,K18QV11,2,CHILDRENS NAME AND BIRTHDAY,18=HATE SYMBOL,N,1,CHILDRENS NAME AND BIRTHDAY
7824,SUC1A 1,3,NO MICRO,SUCIA1 IS MARKED UNACCEPTABLE,N,3,Bad words suck you all
15543,M17LOVE,2,MITCHELLE FAVORITE NUMBER LOVE,"M17 IS A GUN, WEAPON REFERENCE",N,1,MITCHELLE FAVORITE NUMBER LOVE
18596,PURE FN,,MY COMPANY NAME IS PURE FINANCIAL,PURE FUN OR PURE SEX,Y,1,MY COMPANY NAME IS PURE FINANCIAL
16404,SLYNPOW,2,SLAYIN POWDER SNOWBAORDING TERM FOR RIDING POWDER,SLAYING,N,1,SLAYIN POWDER SNOWBAORDING TERM FOR RIDING POWDER
10793,NACLBLS,7,I AM A CALIFORNIA STATE PARAMEDIC AND THE N A C L IS THE CHEMICAL NAME FOR SODIUM CHLORIDE (IV SOLUTION) AND THE B L S IS BASIC LIFE SUPPORT,NACL IS SCIENTIFIC TERM FOR SALT… SALT BALLS?,N,1,I AM A CALIFORNIA STATE PARAMEDIC AND THE N A C L IS THE CHEMICAL NAME FOR SODIUM CHLORIDE (IV SOLUTION) AND THE B L S IS BASIC LIFE SUPPORT
9126,BIGGBLU,7,VAN IS THE COLOR BLUE,BLUE-GANG,Y,1,VAN IS THE COLOR BLUE
4940,2OH9 GTO,2,PONTIAC GTO FROM THE 209 AREA CODE,209 AREA CODE,N,3,209 AREA CODE. PONTIAC GTO FROM THE 209 AREA CODE
16502,IJNIP,2,IN JESUS NAME I PRAY.,"NIP, OFFENSIVE",N,1,IN JESUS NAME I PRAY.
4982,OMGXWTF,3,OH MY GOD WHAT THE FREAK,WHAT THE FUCK,N,2,WHAT THE FUCK
8093,GTWBALZ,2,MUSTANG GT WITH AFTERMARKET POWER MODIFICATIONS,BALLS.. GOT BALLS?,N,1,MUSTANG GT WITH AFTERMARKET POWER MODIFICATIONS
2298,EY VATO,7,HEY BUDDY,VATO GANG SLANG,N,1,HEY BUDDY in Spanish
21755,BLOWWWN,1,VEHICLE IS A HELLCAT WITH A SUPERCHARGED (OR BLOWN) ENGINE.,BLOWN SEXUAL REFERENCE OR DRUG REFEERNCE,N,1,VEHICLE IS A HELLCAT WITH A SUPERCHARGED (OR BLOWN) ENGINE.
20053,BLUPHX,2,BLUE PHOENIX TO RISE FROM THE ASHES,"BLUE, GANG REFERENCE",Y,1,BLUE PHOENIX TO RISE FROM THE ASHES
17950,WREATER,2 or 1,IT MEANS I COMPEAT WITH WIDE RECEIVERS ON THE FOOTBALL FIELD,WIDE RECEIVER EATER (AND THERE IS NO EAT IN COMPETE),N,1,IT MEANS I COMPEAT WITH WIDE RECEIVERS ON THE FOOTBALL FIELD
23080,2NDN8TR,7,SECOND NATURE- MY BUSINESS NAME,TERMINATOR,N,1,SECOND NATURE- MY BUSINESS NAME
12498,BLQXTC,,BLACK ECSTASY,ECSTASY IS A DRUG REFERENCE,N,2,ECSTASY IS A DRUG REFERENCE
9840,HELLC16,,HELLCAT 2016 NAME OF THE DODGE CHALLENGER CAR MODEL,HELL,Y,1,HELLCAT 2016 NAME OF THE DODGE CHALLENGER CAR MODEL
14360,PB1O 51O,2,PUNJA 510,510 = AREA CODE,N,1,PUNJA 510
16507,KING BRA,1,ITS A 2014 SHELBY COBRA AND IT IS KING.,PULLED FOR BRA,Y,1,ITS A 2014 SHELBY COBRA AND IT IS KING.
4478,BLKSKAT,1,COLOR AND MODEL OF VEHICLE,SCAT IS ANOTHER NAME FOR SHIT.. COULD BE SAYING BLACKS CAT OR BLACK SCAT,N,1,COLOR AND MODEL OF VEHICLE
3162,FK TRUMP,3,NOTHING,FUCK TRUMP,N,2,FUCK TRUMP
521,BLCK BST,2,BLACK BEAST FOR BLACK DODGE CHALLENGER,HAS A 2013 DODGE CP ON ANI,Y,3,BLACK BEAST FOR BLACK DODGE CHALLENGER HAS A 2013 DODGE CP ON ANI
15838,R8DER88,2,IMA RAIDER FAN AND I WAS BORN ON 1988,88 = HATE NUMBER,N,1,IMA RAIDER FAN AND I WAS BORN ON 1988
6831,DRV PINK,1,DRIVE PINK = SUPPORTING BREAST CANCER RESEARCH,PINK SEXUAL REFERENCE,N,1,DRIVE PINK = SUPPORTING BREAST CANCER RESEARCH
15914,SLM O916,2,INITIALS AND B DAY,916 AREA CODE,N,1,INITIALS AND B IRTHDAY 
13513,LAHOOD1,2,LAST NAME,LA HOOD? (LAST NAME IS LAHOOD),Y,0,
3823,GUNSTOR,2,I OWN TWO GUN STORES,GUN STORE,N,3,I OWN TWO GUN STORES GUN STORE
7252,911 JUMP,5,EMERGENCY JUMPSTART,911 EMERGENCY,N,1,EMERGENCY JUMPSTART
3099,TPOTKID,D,"TEA POT KID, MY DADS NICKNAME AND WE INHERITED HIS CAR",POT MARY JANE MARIJUANA,N,1,"TEA POT KID, MY DADS NICKNAME AND WE INHERITED HIS CAR"
3937,OGSICK1,2,PERSONAL MEANING,OG,N,0,
8368,FLAT SEX,1,REFERS TO THE SPECIAL FLAT 6 NORMALLY ASPIRATED ENGINE WHICH IS IN THE CAR,SEX….,N,1,REFERS TO THE SPECIAL FLAT 6 NORMALLY ASPIRATED ENGINE WHICH IS IN THE CAR
11753,BLKBEZY,3,"BLACK FOR BLACK CAR, BEEZY NICKNAME",BEZY=BEEZY WHICH IS SLANG FOR BITCH,N,1,"BLACK FOR BLACK CAR, BEEZY NICKNAME"
21570,STANKEE,1,(VEHICLE) IT STINKS,CAN BE SLANG FOR VAGINA,N,1,(VEHICLE) IT STINKS
17937,L A BUMZ,2,LOS ANGELES DODGERS ARE BUMS. GO GIANTS!,an insult… but has been out spelled with an s since 1984,N,2,an insult… but has been out spelled with an s since 1984
6814,MY 1 TACO,1,MY FIRST TACOMA. TACO IS SHORT FOR TACOMA (TOYOTA TRUCK),TACO SEXUAL REFERENCE,N,1,MY FIRST TACOMA. TACO IS SHORT FOR TACOMA (TOYOTA TRUCK)
21387,R1O2712,6,BIRTH DATE,LOOK ALIKE,N,1,BIRTH DATE
1089,515OR8,2,OAKLAND RAIDERS FAN NICKNAME,CRAZY R8,Y,1,OAKLAND RAIDERS FAN NICKNAME
22054,KHACH$U,2,MEMORIAL FOR MY OLDER BROTHER WHO PASSED AWAY,"YOU, COULD BE CONSIDERED HOSTILE",Y,1,MEMORIAL FOR MY OLDER BROTHER WHO PASSED AWAY
22901,IRINA D,1,WIFES NAME,STAND ALONE D,N,1,WIFES NAME
19079,OO7S911,,JAMES BOND CAR,911 EMERGENCY,Y,1,JAMES BOND CAR
16188,3OH XHT,,30 IS MY FAVORITE NUMBER. H IS MY LOVERS INTIAL. X FOR KISS. HT IS MY INITIALS,THANKS HOE,N,1,30 IS MY FAVORITE NUMBER. H IS MY LOVERS INTIAL. X FOR KISS. HT IS MY INITIALS
8057,PAPO,1,MEANS LITTLE BOY,SPANISH SLANG FOR VAGINA,N,2,SPANISH SLANG FOR VAGINA
8023,GRVSEND,2,GRAVES END AN AREA OF BROOKLYN NY,"GRAVE SEND, LIKE SEND YOU TO THE GRAVE? BUT GRAVESEND IS A NEIGHBORHOOD IN BROOKLYN",N,1,GRAVES END AN AREA OF BROOKLYN NY
21339,GTOKEEF,7D,KEITHS GTO,"GTO KEEF, KEEF IS THE CRYSTALS ON MARIJUANA",N,1,KEITHS GTO
1001,MAS TACO,1,TACOMAS IN RANDOM SEQUENCE,TACO SLANG FOR VAGINA,N,1,TACOMAS IN RANDOM SEQUENCE
3046,415 JEEP,2,POLICE CODE FOR DISTURBANCE AND MAKE OF VEHICLE,415 AREA CODE,N,1,POLICE CODE FOR DISTURBANCE AND MAKE OF VEHICLE
17184,82 WPB,3,82 FOOT US COAST GUARD PATROL BOAT,WE PULL BITCHES. THIS IS A VETERAN AUTO PLATE,Y,2,WE PULL BITCHES. THIS IS A VETERAN AUTO PLATE
13533,8O5BUMN,2,(805) AREA CODE IN SANTA BARBARA (BUMN) BEING A BUM ON THE BEACH,805 = AREA CODE,N,1,(805) AREA CODE IN SANTA BARBARA (BUMN) BEING A BUM ON THE BEACH
17096,BLU7PRL,2,SPIRITUAL WISDOM,BLUE,Y,3,SPIRITUAL WISDOM BLUE 
8779,LT HOE,3,LITTLE MODEL LY CHEVY TAHOE,HOE-WHORE,N,2,HOE-WHORE
19388,SAVG TRD,2,SAVAGE TOYOTA RACING DEVELOPMENT,"PULLED FOR SAVAGE, TRD",Y,1,SAVAGE TOYOTA RACING DEVELOPMENT
1270,NR & OG,7,NO REGRETS ORIGINAL MEMBER. ITS A CAR CLUB.,OG-ORIGINAL GANGSTER,N,1,NO REGRETS ORIGINAL MEMBER. ITS A CAR CLUB.
15435,GRINNY G,2,I GRIN A LOT,G = GANGSTER,N,1,I GRIN A LOT
16243,SXYLITB,1,SEXY LITTLE BUICK,"THE B MOST LIKELY STANDS FOR BITCH, SEXY LIT BITCH",N,2,"THE B MOST LIKELY STANDS FOR BITCH, SEXY LIT BITCH"
15653,KRAPF,3,FAMILY NAME,KRAPF IS THE CUSTOMERS LAST NAME BUT KRAPF IS VERY SIMILAR TO CRAP,N,1,FAMILY NAME
7690,4BULYS,2,NO MICRO,BULLIES LIKE PICK ON PEOPLE? IT IS A PET PLATE SO PROBABLY PITBULLS,Y,0,
6995,IIDH8TO,7,INDUSTRIAL INJECTION DIESEL HOUSTON,HATE IS STICKING OUT,N,1,INDUSTRIAL INJECTION DIESEL HOUSTON
639,2JS OSHT,3,FUNNY QUOTE FROM THE MOVIE FAST AND  FURIOUS,OH SHIT,N,1,FUNNY QUOTE FROM THE MOVIE FAST AND  FURIOUS
7325,PC PUMPN,2,STANDS FOR PACIFIC COAST CONCRETE PUMPING,PUMPIN IS A SEXUAL REFERENCE,N,2,PUMPIN IS A SEXUAL REFERENCE
11432,PEW X2,D,PEW PEW WAS TAKEN. ITS A FUNNY WAY OF SAYING TARGET PRACTICE FOR VETERA,REFERENCE TO A GUN,Y,1,PEW PEW WAS TAKEN. ITS A FUNNY WAY OF SAYING TARGET PRACTICE FOR VETERA
20226,TMGLIFE,1,MY LIFESTYLE,TMG = TAKE MANS GASH (GIRL),Y,2,TMG = TAKE MANS GASH (GIRL)
21659,GUN1NER,2,MOTORCYCLE MODEL,GUN OR GUNNER,N,1,MOTORCYCLE MODEL
716,MO THUGZ,2,HIGH SCHOOL NICKNAME,THUGZ,N,1,HIGH SCHOOL NICKNAME
18211,RAPT KLR,2,VEHICLE HAS A VINYL BODY WRAP AND ITS FAST SO ITS A KLR RIDE,PULLED FOR KILLER,N,1,VEHICLE HAS A VINYL BODY WRAP AND ITS FAST SO ITS A KLR RIDE
1790,2F4 PLAY,,no micro,TO FORPLAY SEXUAL REFERENCE,N,2,TO FORPLAY SEXUAL REFERENCE
14165,FKNJAYY,3,NICK NAME,FUCKING JAY,N,2,FUCKING JAY
2221,TNT GPA,2,NO MICRO,TNT,N,0,
17979,HNC 72,2,NO MEANING WRITTEN ON REG 17,"URBAN DICTIONARY SAYS HNC=HNIC, AN ACRONYM CONTAINING THE N WORD. 72=THE YEAR SHE WAS BORN",N,2,"URBAN DICTIONARY SAYS HNC=HNIC, AN ACRONYM CONTAINING THE N WORD. 72=THE YEAR SHE WAS BORN"
21371,NISMO J,7D,NISMO IS THE TYPE OF NISSAN JUKE I OWN AND J IS FOR MY FOR FIRST NAME,J COULD STAND FOR JOINT,Y,1,NISMO IS THE TYPE OF NISSAN JUKE I OWN AND J IS FOR MY FOR FIRST NAME
22028,SD14,2,WIFES INITIALS AND MY SONS DATE OF BIRTH,"14, GANG REFERENCE",N,1,WIFES INITIALS AND MY SONS DATE OF BIRTH
4205,PUFF N1,D,PUFF IS FOR PUFIN WHICH IS A BIRD. N MEANS IN. 1 AS IN GOLF HOLE IN ONE,PUFFIN ONE… SMOKING ONE,N,1,PUFF IS FOR PUFIN WHICH IS A BIRD. N MEANS IN. 1 AS IN GOLF HOLE IN ONE
20961,B 7 KY,1,7 IS MY FAVORITE NUMBER AND KY IS WHAT PEOPLE CALL ME,NAME IS KIKY… KY COULD HAVE A SEXUAL CONNOTATION,Y,1,7 IS MY FAVORITE NUMBER AND KY IS WHAT PEOPLE CALL ME
17658,GDELEON,2,OWNERS NAME,"G, GANG REFERENCE",N,1,OWNERS NAME
733,RAMS31O,7,NO MICRO,310 BELLFLOWER AREA CODE,N,0,
11423,MAMRED,2,LOVE MOM RED,GANG COLOR,Y,1,LOVE MOM RED
14667,MAY*88,2,NO MEANING ON REG 17,88=HATE SYMBOL,N,0,
309,QUIK II,1,THE CAR IS A CHEVY II (CHEVY 2) AND IT IS VERY QUICK,"QUICKIE CAN HAVE SEXUAL CONNOTATIONS, CUSTOMER DOES HAVE A LOT OF CHEVYS",N,1,THE CAR IS A CHEVY II (CHEVY 2) AND IT IS VERY QUICK
23447,GRDEAD,2,ABBREVIATION FOR MY FAVORITE BAND THE GRATEFUL DEAD,DEAD ON A PET LOVERS PLATE?,N,1,ABBREVIATION FOR MY FAVORITE BAND THE GRATEFUL DEAD
19425,PANDA13,2,PANDA THE ANIMAL AND GRADUATION YEAR,13 = GANG NUMBER,N,1,PANDA THE ANIMAL AND GRADUATION YEAR
18031,GOTAB18,2,A SPECIFIC TYPE OF HONDA MOTOR. A B18 IS A  MOTOR IN THE SPECIFIC BSERIES CLASS OF  HONDA,"18, GANG REFERENCE",N,1,A SPECIFIC TYPE OF HONDA MOTOR. A B18 IS A  MOTOR IN THE SPECIFIC BSERIES CLASS OF  HONDA
17960,CATNI,1,MY WIFE AND I,"CAT=PUSSY, HE ALREADY HAS CATIAM",Y,1,MY WIFE AND I
5664,JAPXCN,2,JAPANESE MEXICAN,JAP SLANG FOR JAPANESE,N,1,JAPANESE MEXICAN
6128,D#KIKE,4,D FOR THE FIRST LETTER OF MY DAUGHTERS NAME AND DANIELA. KIKE IS FOR NICKNAME FOR MY SON ENRIQUE,KIKE IS RACIST SLANG TOWARDS JEWISH PEOPLE.,N,3,D FOR THE FIRST LETTER OF MY DAUGHTERS NAME AND DANIELA. KIKE IS FOR NICKNAME FOR MY SON ENRIQUE KIKE IS RACIST SLANG TOWARDS JEWISH PEOPLE.
7584,GOBLU23,2,UNIVERSITY OF MICHIGAN BAND SONG LETS GO BLUE 23 IS MY FAVORITE NUMBER,BLUE=GANG COLOR,Y,1,UNIVERSITY OF MICHIGAN BAND SONG LETS GO BLUE 23 IS MY FAVORITE NUMBER
1316,OGDUZIT,2,NICKNAME,ORIGINAL GANGSTER,N,1,NICKNAME
14810,O9WOODY,1,CAR IS 2009 FORD FLEX WITH A FAKE WOODY  PAINT JOB,WOODY IS ANOTHER WORD FOR PENIS,N,1,CAR IS 2009 FORD FLEX WITH A FAKE WOODY  PAINT JOB
788,BAD 13.00,2,NO MICRO,13-GANG,N,0,
2269,18HD BYZ,2,1800S IS WHEN PERU GOT THEIR INDEPENDENCE,18-HITLER,N,2,18-HITLER
8258,AOB 4ME,2,All of Books 4 Me To Read,"AOB is a street gang in Sacramento, customer is in N. Highlands",N,1,All of Books 4 Me To Read
21496,JIVECAT,1,COOL GUY,"CAT, SEXUAL REFERENCE",Y,1,COOL GUY
19688,AHHDAMN,3,JUST MY EVERYDAY EXPRESSION EVERYTIME I SEE AN AWESOME OR FUNNY STUFF I TEND TO SAY OHH DAMN. THANK YOU!,"DAMN, PROFANITY",N,1,JUST MY EVERYDAY EXPRESSION EVERYTIME I SEE AN AWESOME OR FUNNY STUFF I TEND TO SAY OHH DAMN. THANK YOU!
21240,PAGERO8,2,EIGHTY EIGHT,MEANING SAYS 88 = HATE NUMBER (No 88 on ANI),Y,0,
22722,GT 5O CS,5,2011 MUSTANG GT CALIFORNIA SPECIAL,"5O, LAW ENFORCEMENT REFERENCE",Y,1,2011 MUSTANG GT CALIFORNIA SPECIAL
18983,1BLKBOX,1,ONE BLACK BOX BECAUSE MY CAR IS SHAPED LIKE A BOX AND ITS BLACK,box=vagina. Customer has a 2016 Ford UT,N,1,ONE BLACK vagina  bad words
22357,TNT12B,2,EXPLOSIVE COMBAT ENGINEER,TNT,N,3,TNT12B
1669,69  VA,1,1969 NOVA,"69, no 1969 car on ani",N,2,"69, no 1969 car on ani"
4013,2REDRUM,2,ONLY HORSE IN THE HISTORY OF THE AINTREE GRAND NATIONAL TO WIN THREE TIMES,MURDER,N,2,MURDER
19558,VRGON,,NAME,"VIRGIN, ITS NOT CUSTOMERS NAME",Y,1,NAME
283,KATITUD,1,"ATTITUDE, CATTITUDE. WILL BE ON A JAGUAR.","NO JAGUAR ON ANI, CAT=PUSSY",N,1,"ATTITUDE, CATTITUDE. WILL BE ON A JAGUAR."
9873,TLB8888,,TLB IS MY NAME . NUMBER 8 IS LUCKY NUMBER.,88 HILTER REFERENCE,N,1,TLB IS MY NAME . NUMBER 8 IS LUCKY NUMBER.
15531,L9NEGRA,2,MY TRUCK IS ALL BLACK SO I CALL HER LA NEGRA. ITS A SPANISH MEANING FOR A BLACK TRUCK,NEGRA IS SIMILAR TO NEGRO,N,1,MY TRUCK IS ALL BLACK SO I CALL HER LA NEGRA. ITS A SPANISH MEANING FOR A BLACK TRUCK
4350,U2RNEXT,2,FORUM NAME,THREATENING? YOU TOO ARE NEXT,N,2,THREATENING? YOU TOO ARE NEXT
13647,CRXXXAL,1,"CRYSTAL, A GIRLS NAME. WITH THREE X IN PLACE OF Y, S AND T.",XXX SEXUAL REFERENCE,N,1,"CRYSTAL, A GIRLS NAME. WITH THREE X IN PLACE OF Y, S AND T."
22826,7MACK,1,US ARMY VETERAN,MAC IS ANOTHER WORD FOR PIMP,Y,1,US ARMY VETERAN
3840,SUPR TCO,1,NICKNAME,SUPER TACO. COULDNT VERIFY TOYOTA,N,2,SUPER TACO. COULDNT VERIFY TOYOTA
21278,VRMBL B,3,RMBLE B WASNT AVAILABLE SO I OPTED FOR THIS. THE VEHICLE IS YELLOW AND  BLACK AND FAST. VROOM AND LOOKS LIKE A BUMBLE BEE. HEE HEE. OH AND I  LOVE THE AMERICA!,STAND ALONE B (2016 Chevy on record),Y,0,
18513,CODE MKY,,CODE MONKEY IS A NICKNAME FOR SOFTWARE DEVELOPERS - WHICH I AM.,LOOKS LIKE MONKEY,N,1,CODE MONKEY IS A NICKNAME FOR SOFTWARE DEVELOPERS - WHICH I AM.
15746,ESKLAID,1,IT MEANS ESCALADE IN DIFERENT WORDS,"HAS A 2015 CADI, PULLED BECAUSE OF THE WAY LAID IS SPELLED, A SEXUAL CONNOTATION",Y,2,"HAS A 2015 CADI, PULLED BECAUSE OF THE WAY LAID IS SPELLED, A SEXUAL CONNOTATION"
2051,7YDP18,2,NO MICRO,18-HITLER,N,2,18-HITLER
18636,3B$CHON,,WE OWN 3 BICHON FRISE DOGS. THIS IS NOT A SWEAR WORD.,3 BITCHIN,Y,3,WE OWN 3 BICHON FRISE DOGS. THIS IS NOT A SWEAR WORD.3 BITCHIN
17089,78SC911,2,THE CAR IS A 1978 MODEL YEAR PORSCHE 911 AND IN THAT YEAR IT WAS CALLED A 911SC,911 EMERGENCY,Y,1,THE CAR IS A 1978 MODEL YEAR PORSCHE 911 AND IN THAT YEAR IT WAS CALLED A 911SC
12369,CHP1969,,REFERS TO THE YEAR OF MANUFACTURE AND  FORMER AGENCY FOR WHICH THE CAR USED TO SERVE,"CHP, POLICE REFERENCE",N,1,REFERS TO THE YEAR OF MANUFACTURE AND  FORMER AGENCY FOR WHICH THE CAR USED TO SERVE
12384,FACT5O,,DJ NAME,"5O, POLICE REFERENCE",N,2,"FUCK 5O, POLICE REFERENCE"
17530,HNTRTRK,2,HUNTERS TRUCK,"HUNT, HOSTILE",Y,1,HUNTERS TRUCK
15898,F4OEATR,1,"MY LAST CAR, AN F40 BIT IT & THIS IS MY REPLACEMENT",EAT,N,1,"MY LAST CAR, AN F40 BIT IT & THIS IS MY REPLACEMENT"
17924,G WULF,2,IT MEANS GRAY WULF NATIVE AMERCAN NAME.,G=GANGSTER,N,1,IT MEANS GRAY WULF NATIVE AMERCAN NAME.
14350,MNT MRDR,2,"PAYING HOMAGE TO A TRIBE CALLED QUESTS ALBUM, MIDNIGHT MARAURDERS",PULLDED FOR MRDR = MURDER?,N,2,PULLDED FOR MRDR = MURDER?
22309,OMW7FYB,1,"MEANING ON MY WAY FOREVER YOUNG BABE, AND THE 7 IS HOW LONG WE HAVE BEEN TOGETHER.",ON MY WAY FUCK YOU BITCH,N,2,ON MY WAY FUCK YOU BITCH
9455,HH 20,2,INITIALS AND BIRTHDAY,HAIL HITLER,Y,1,INITIALS AND BIRTHDAY
7807,CALKUSH,2,FROM A POPULAR SONG.,CALIFORNIA KUSH WEED,N,0,
6669,707 OMG,7,MY CAR HAS 707 HORSEPOWER. SO OH MY GOD JUST EMPHASIZES.,707- SANTA ROSA AREA CODE,N,1,MY CAR HAS 707 HORSEPOWER. SO OH MY GOD JUST EMPHASIZES.
21394,SNWBNDT,7D,SNOW BANDIT. MEANING I LOVE THE SNOW.,"SNOW CAN BE ANOTHER WORD FOR COCAINE, COCAINE BANDET",Y,1,SNOW BANDIT. MEANING I LOVE THE SNOW.
17322,MAXATTK,2,MAXIMUM ATTACK,"ATTACK, HOSTILE TERM",N,1,MAXIMUM ATTACK
5343,TERRA18,2,NOT AVAILABLE ON QUICKWEB YET,18=HATE SYMBOL,N,0,
2366,HUMMY,1,"NICKNAME FOR VEHICLE, WHICH IS A HUMMER H3.",HUM IS A SLANG WORD FOR FELACIOUS ACTS,N,1,"NICKNAME FOR VEHICLE, WHICH IS A HUMMER H3."
18643,BSD 88.00,,INITIALS OF MY FULL NAME 88 IS GOOD FENG SHUI,88 HITLER REFERENCE,N,1,INITIALS OF MY FULL NAME 88 IS GOOD FENG SHUI
15555,OHELLNA,3,OH HELL NO!,"HELL, OFFENSIVE",N,1,OH HELL NO!
813,G TIMES,7,GOOD TIMES,G,N,1,GOOD TIMES
16906,BRAAP88,2,COMPANY NAME - BRAAP - ITS THE SOUND A MOTORCYCLE MAKES WHEN ITS ON THE THROTTLE. 1988 YEAR OF THE VEHICLE,88 = HATE NUMBER,N,1,COMPANY NAME - BRAAP - ITS THE SOUND A MOTORCYCLE MAKES WHEN ITS ON THE THROTTLE. 1988 YEAR OF THE VEHICLE
15074,GMR BAE,,GAMER BABE,GAMER SHIT OR GAMER BABE,N,1,GAMER BABE
15998,MSCL 5OH,5,CAR NAME/STYLE,PULLED FOR 5O,N,2,PULLED FOR 5O
10916,5O KLBR,7,50 CALIBER,50 CALIBAR-GUNS,N,2,50 CALIBAR-GUNS
16696,1KLR67,2,ONE KILLER MUSTANG 67,"KILLER, HOSTILE",N,1,ONE KILLER MUSTANG 67
22536,MY FJ14,2,MY FJ CRUISER 2014,"14 = GANG NUMBER (FJ 14 Toyota Land Cruiser, No toyota on ANI)",N,1,MY FJ CRUISER 2014
14226,BRAWL,2,BRAWLER,FIGHTING HOSTILE TERM,N,1,BRAWLER
13376,O8STAR8,2,DAUGTHER NAME IN MEMORY,"88, GANG REFERENCE",Y,1,DAUGTHER NAME IN MEMORY
14807,NOT4U2K,2,NOT FOR YOU TO KNOW,"U, HOSTILE",N,1,NOT FOR YOU TO KNOW
1334,TNT&RDH,2,DYNOMITE REGISTERED DENTAL HYGIENIST,TNT AS IN BOMB,N,1,DYNOMITE REGISTERED DENTAL HYGIENIST
13082,DJ GATO,1,DJ NAME,DJ CAT,Y,1,DJ NAME
16440,8BADGER,2,NICKNAME,ATE BADGER,N,2,ATE BADGER
5815,KYLSTRK,2,KYLES TRUCK,KILL STREAK,N,1,KYLES TRUCK
22476,PPSYKAT,1,PURPLE SILVER CAT,PUSSY CAT,N,3,PURPLE SILVER CAT PUSSY CAT
11402,GNS2REV,2,GENESIS TO REVELATION,WEAPON,Y,1,GENESIS TO REVELATION
21447,67 428HO,3,67= CAR YEAR 428= ENGINE SIZE HO= HIGH OUTPUT MOTOR,"HO, PROFANITY",N,1,67= CAR YEAR 428= ENGINE SIZE HO= HIGH OUTPUT MOTOR
20247,FUCTRMP,3,FA FAMILIES FIRST LETTER INITIALS,FUCK TRUMP,N,2,FUCK TRUMP
18760,FRODO 13,2,NO MICRO,13 = GANG NUMBER,N,0,
23132,FDAPOPO,3,FAMILY PETS NAME,"FUCK THE POLICE, LAW ENFORCEMENT REFERENCE",N,1,FAMILY PETS NAME
19939,JFZME,3,"MY FIRST INITIAL, MY WIFES FIRST INITIAL, AND THE FIRST INITIALS OF OUR CHILDREN.",J FS ME COULD MEAN J FUCKS ME,N,1,"MY FIRST INITIAL, MY WIFES FIRST INITIAL, AND THE FIRST INITIALS OF OUR CHILDREN."
12906,SECAMDT,2,SECOND AMENDMENT,"SECOND AMENDMENT, GUN REFERENCE",N,3,"SECOND AMENDMENT SECOND AMENDMENT, GUN REFERENCE"
19879,EL BUSH,1,NICKNAME,COULD HAVE SEXUAL CONNOTATION,N,0,
3231,ASDF42O,D,A SUPER DUPER FIGURE: 420,"420, DRUG CONNOTATIONS",N,0,
654,$2EAT P,1,LOVE TO EAT PIZZA AND OWN A PIZZA HUT  RESTURANT,LOVE TO EAT PUSSY,N,2,LOVE TO EAT PUSSY
14337,IHV2SHT,2,I HAVE TO SHOOT (BASKETBALL),I HAVE TO SHIT,N,1,I HAVE TO SHOOT (BASKETBALL)
13548,POLIZE1,5,MY BASKETBALL NAME.,POLIZE = GERMAN FOR POLICE,N,2,POLIZE = GERMAN FOR POLICE
18538,GANG PAO,,THIS IS MY NICKNAME IN CHINESE,GANG,N,1,THIS IS MY NICKNAME IN CHINESE
19288,DAMTGRM,2,A SAYING IN THE FARSI LANGUAGE SHOWING APPRECIATION,"DAMMIT, PROFANITY",N,2,"DAMMIT, PROFANITY"
20006,ZILL4,2,IT IS A NICKNAME FOR MY GREEN CAR,LOOKS SIMILAR TO ZILLA WHICH IS A GANG REFERENCE (Has 2015 Dodge Coup),Y,2,LOOKS SIMILAR TO ZILLA WHICH IS A GANG REFERENCE (Has 2015 Dodge Coup)
17991,NJYABWL,7D,MY DJ NAME,ENJOY A BOWL (MARIJUANA REFERENCE) OR ENJOYABLE,N,2,ENJOY A BOWL (MARIJUANA REFERENCE) OR ENJOYABLE
6894,HONDO13,7,NAME AND LUCKY NUMBER,13-GANG,N,1,NAME AND LUCKY NUMBER
16911,DE666VL,6,MY FAVORITE NUMBERS AND DEV IS MY WIFES NAME. L IS LAST INITIAL,CONFIGURATION (DP PLATE),Y,1,MY FAVORITE NUMBERS AND DEV IS MY WIFES NAME. L IS LAST INITIAL
10159,CHEVY G,7,NO MICRO,G-GANGSTER,N,0,
21717,T WILLI,2,NICKNAME,PULLED FOR WILLI Customers name is Tyler Williams,Y,3,Tyler Williams
22392,MTF BWM,3,LITERALLY MAY THE FORCE BE WITH ME.,"MTF MOTHER FUCKER male to female transexual 523 Up, 129 Down",Y,2,"MTF MOTHER FUCKER male to female transexual 523 Up, 129 Down"
8888,13E13 A,2,"13 (TERA) IN PUNJABI MEANS YOURS. COMPLETE MEANING OF PLATE IS THAT HE ALMIGHTY GOD, ALL IS YOURS",13=GANG NUMBER,N,1,"13 (TERA) IN PUNJABI MEANS YOURS. COMPLETE MEANING OF PLATE IS THAT HE ALMIGHTY GOD, ALL IS YOURS"
12094,BEEZYYY,3,MY NICKNAME,ANOTHER WORD FOR BITCH,N,2,ANOTHER WORD FOR BITCH
9410,NUTS 4RV,1,ALMOND FARMERS RV,NUTS FOR RV,N,1,ALMOND FARMERS RV
7589,INIM OG,2,GO MINI (BACKWARDS),OG ORIGINAL GANGSTER,N,1,GO MINI (BACKWARDS)
5903,USA GOV,5,name,could be misconstrued as a government car,N,3,USA Government
10747,HULK818,2,FAVORITE CARTOON,818 ARA CODE,N,1,FAVORITE CARTOON
15260,MY1KITT,1,KNIGHT RIDER SHOW,COULD HAVE SEXUAL CONNOTATION,Y,1,KNIGHT RIDER SHOW
16369,DANI 13,2,NICKNAME AND LUCKY NUMBER,13 GANG REFERENCE,N,1,NICKNAME AND LUCKY NUMBER
1825,S55O FTW,3,S55O FOR THE WIN,FTW,N,1,S55O FOR THE WIN
12417,KUHNS,,"MY LAST NAME, A GIFT FOR MY DAD",SIMILAR TO COONS WHICH CAN BE A RACIAL TERM,N,1,"MY LAST NAME, A GIFT FOR MY DAD"
16879,4 NEG RA,2,MY WIFES NICK NAME,"NEGRA=BLACK, SOME SIMILAR PLATES ARE OUT BUT A COUPLE ARE UNACCEPTABLE",N,2,"NEGRA=BLACK, SOME SIMILAR PLATES ARE OUT BUT A COUPLE ARE UNACCEPTABLE"
8810,BLUEVAS,2 or 1,my car is blue and my name is vas,"pulled for the color blue, also blue vein=penis (name is Vacil)",N,1,my car is blue and my name is vas
6080,1MOBMRS,2,AN AIR FORCE UNIT I WAWS IN AND THE MRS IS FOR MY WIFE,MOB MRS,N,1,AN AIR FORCE UNIT I WAWS IN AND THE MRS IS FOR MY WIFE
7417,LMU13BR,7,THE UNIVERSITY HE GRADUATED FROM LOYOLA MARYMOUNT,GANG NUMBER,N,1,THE UNIVERSITY HE GRADUATED FROM LOYOLA MARYMOUNT
23314,AK47 2A,2,SECOND AMENDMENT RIGHT,AK 47 GUN,N,2,AK 47 GUN
15097,STLR714,2,NOT ON QUICKWEB YET,714 GARDEN GROVE AREA CODE,N,1,NOT ON QUICKWEB YET
2724,8CHNGON,2,MY NICKNAME,BADASS,N,1,MY NICKNAME
6127,805 TACO,1,805 IS MY AREA CODE AND TACO IS THE VEHICLE THAT THE PLATE IS GOING ON ITS A TACOMA PICKUP TRUCK,805 IS PASO ROBLES AREA CODE. TACO IS SLANG FOR VAGINA,N,1,805 IS MY AREA CODE AND TACO IS THE VEHICLE THAT THE PLATE IS GOING ON ITS A TACOMA PICKUP TRUCK
22067,OGOVOLT,2,MY ELECTRIC CAR,"OG, GANG REFERENCE",N,1,MY ELECTRIC CAR
12395,GSWAGG,,IT ALLUDES TO THE NAME OF THE CAR.  (G WAGON),"G, GANG REFERENCE",Y,1,IT ALLUDES TO THE NAME OF THE CAR.  (G WAGON)
19258,86868,6,GOOD LUCK NUMBERS,ALL DIGITS,Y,1,GOOD LUCK NUMBERS
6367,SCAT2NV,2,FOR A 2015 DODGE CHALLENGER SCAT PACK TO ENVY,SHIT TO ENVY SCAT MEANS FECES,N,1,FOR A 2015 DODGE CHALLENGER SCAT PACK TO ENVY
11343,TRQ*STR/,2,TORQUE STEER,"TRACK STAR, GANG RELATED AND SLANG FOR PROMISICIOUS WOMAN",N,1,TORQUE STEER
1813,BYRNE88,2,LAST NAME AND YEAR I WAS BORN,88-HITLER,N,1,LAST NAME AND YEAR I WAS BORN
18274,SPC MKNY,1,SPACE MONKEY,PULLED FOR MONKEY,N,1,SPACE MONKEY
14910,O G G,2,ORLANDO GIL GONZO,"OG, G",N,0,
4852,SAMRA 13,2,MY LAST NAME,13,N,1,MY LAST NAME
6841,BUBA13,7,NO MICRO,13-GANG NUMBER,N,0,
7908,RUBRITA,1,JEEP NICKNAME,RUB RITA,N,2,RUB RITA
10903,EST6T9,1,YEAR I WAS BORN,NO 69 CAR,N,1,YEAR I WAS BORN
16698,1WARCAT,2,ONE WAR CAT,"WAR, WEAPON REFERENCE",N,1,ONE WAR CAT
